{
  "schema": "github-lifecycle-manifest.v1",
  "manifest_version": "1.0.0",
  "specification": {
    "spec_id": "JK-SPEC-GHLIFE-001",
    "title": "GitHub-native lifecycle specification and evidence packet",
    "source_document": "docs/github-native-lifecycle-read-propose-packet.md",
    "source_revision": "ca942ac07abc9e92599c2ebc05c0523d627318b1",
    "ratified_on": "2026-07-26",
    "status": "Approved by Joel for Phase 0 preservation; effective after merge to main."
  },
  "notes": [
    "Rendering this manifest proposes issue payloads only. Creating the issue batch is external write 3 in the packet's separate-authorization ledger.",
        "GHL-010 declares Requirements: all in the packet; that is expanded here to the explicit requirement list so coverage stays checkable."
  ],
  "requirements": [
    { "id": "GHL-REQ-01", "title": "Faithful issue projection" },
    { "id": "GHL-REQ-02", "title": "Claims and collision control" },
    { "id": "GHL-REQ-03", "title": "Mission provenance" },
    { "id": "GHL-REQ-04", "title": "Bounded lifecycle conducting" },
    { "id": "GHL-REQ-05", "title": "Contributor-fork publication" },
    { "id": "GHL-REQ-06", "title": "Exact-head independent review" },
    { "id": "GHL-REQ-07", "title": "Decision-ready packet and owner attention" },
    { "id": "GHL-REQ-08", "title": "Joel-only adjudication" },
    { "id": "GHL-REQ-09", "title": "Durable graduation" },
    { "id": "GHL-REQ-10", "title": "Repository enrollment" },
    { "id": "GHL-NFR-01", "title": "Identity and authority" },
    { "id": "GHL-NFR-02", "title": "Guarded external writes" },
    { "id": "GHL-NFR-03", "title": "Separation of concerns" },
    { "id": "GHL-NFR-04", "title": "Observability" }
  ],
  "issues": [
    {
      "issue_id": "GHL-001",
      "title": "Bootstrap bounded Manager mission policies",
      "summary": "From the already mission-enabled Manager project, add bounded mission policies and read-only policy preflight for `shared-agent-scripts`, `ucla-tdg-ip-agents`, and `ucla-tdg-project-agents`.",
      "owner_repository": "joelkehle/manager",
      "manager_project": "shared-manager",
      "write_class": "propose",
      "requirements": ["GHL-REQ-03", "GHL-REQ-04", "GHL-REQ-10", "GHL-NFR-01", "GHL-NFR-03", "GHL-NFR-04"],
      "depends_on": [],
      "external_dependencies": ["Merged Phase 0 specification revision"],
      "acceptance_criteria": [
        "Add server-owned `allowed_path_prefixes` and `denied_path_prefixes` to `agent_policy.mission_policy`.",
        "Require every requested bounded scope to be contained by an allowed prefix and no denied prefix; denied prefixes win.",
        "Add a read-only effective-policy/preflight surface returning build identity, registry hash, project policy hash, connector scope, path policy, validation, identities, budgets, and refusal result without creating a mission.",
        "Reject unknown fields and invalid/overlapping path policy that would make a deny ineffective.",
        "Preserve existing Codex-only confinement, distinct contributor/reviewer identity, exact validation-command matching, bounded budgets, and push/deploy refusal.",
        "Apply the exact target policies for `shared-agent-scripts` (`personal` scope), `ucla-tdg-ip-agents` (`ucla` scope), and `ucla-tdg-project-agents` (`ucla` scope) from the specification's policy table.",
        "Refuse before creating a mission record or child process: `agent_policy: null`, disabled mission policy, aggregate root, or unknown project.",
        "Refuse before creating a mission record or child process: `ucla` invocation of `shared-agent-scripts`.",
        "Refuse before creating a mission record or child process: `personal` invocation of either UCLA repository.",
        "Refuse before creating a mission record or child process: any unlisted path or denied path, including a migration, live `.env`, data, UI, vendor, or workspace-router path.",
        "Refuse before creating a mission record or child process: caller-substituted validation command.",
        "Refuse before creating a mission record or child process: caller-widened time or retry budget.",
        "Refuse before creating a mission record or child process: non-Codex contributor/reviewer, identity equality, or identity omission.",
        "Refuse before creating a mission record or child process: `allow_push=true`, `allow_deploy=true`, remote mutation, or credential inheritance.",
        "Refuse before creating a mission record or child process: malformed path, symlink escape, path overlap that bypasses a deny, or unknown policy field.",
        "Add table-driven tests for every positive policy and refusal case.",
        "Document the exact Phase 0 spec revision in the policy change and produce a reviewed exact revision eligible for, but not authorized for, `ACT-REV-01`."
      ],
      "validation_commands": ["go test ./internal/projectsmcp", "scripts/agent-check.sh"],
      "non_goals": [
        "No target-repository implementation.",
        "No issue/claim/publisher adapter.",
        "No GitHub credential or external write.",
        "No deployment, restart, activation, or credential change."
      ]
    },
    {
      "issue_id": "GHL-002",
      "title": "Restore substantive review and bound exact-head retries",
      "summary": "Immediately repair active review-provider compatibility and the unbounded retry loop; improve exact error/retry evidence.",
      "owner_repository": "kehle-tdg-dev/ucla-tdg-ip-agents",
      "write_class": "propose",
      "requirements": ["GHL-REQ-06", "GHL-REQ-07", "GHL-NFR-01", "GHL-NFR-02", "GHL-NFR-04"],
      "depends_on": [],
      "external_dependencies": ["Verified `ACT-REV-01`"],
      "acceptance_criteria": [
        "Remove or conditionally omit unsupported model parameters.",
        "Classify provider auth, credit, rate, and configuration failures explicitly.",
        "Preserve request timestamp and retry state after failure.",
        "Apply documented backoff, attempt ceiling, and age threshold per exact head.",
        "Emit attempt count, unique-head count, age, error class, and exhausted count.",
        "Produce one scoped escalation after exhaustion; do not redispatch every sweep indefinitely.",
        "Prove substantive review and packet eligibility for a current fixture head.",
        "Preserve reviewer/contributor/poster separation and COMMENT-only writes.",
        "Update the contribution-review runbook with exact evidence commands.",
        "Produce a reviewed exact revision eligible for, but not authorized for, `ACT-REV-02`."
      ],
      "validation_commands": [
        "go test ./internal/contributioncoordinator ./internal/githubreview",
        "go test ./..."
      ],
      "validation_notes": "Provider integration proof uses a controlled non-GitHub target first.",
      "non_goals": [
        "No automatic approval, merge, or final request-changes.",
        "No new review service.",
        "No deployment, restart, credential, funding, or live GitHub write."
      ]
    },
    {
      "issue_id": "GHL-003",
      "title": "Add a versioned specification-to-issue manifest and validator",
      "summary": "Versioned spec-to-issue manifest, coverage validator, stable renderer, and write-proposal receipt.",
      "owner_repository": "joelkehle/agent-scripts",
      "write_class": "propose",
      "requirements": ["GHL-REQ-01", "GHL-NFR-02", "GHL-NFR-04"],
      "depends_on": [],
      "external_dependencies": ["Verified `ACT-REV-02`"],
      "acceptance_criteria": [
        "Define a versioned, machine-readable spec and issue-manifest schema.",
        "Preserve spec/requirement IDs, owners, dependencies, acceptance criteria, validation, non-goals, and write class.",
        "Detect unknown requirements, missing coverage, cycles, duplicates, and missing mandatory fields.",
        "Render stable proposed issue titles/bodies without writing GitHub.",
        "Emit an attributable validation receipt and content hash.",
        "Include fixtures for this complete issue batch."
      ],
      "validation_commands": [
        "node --test tests/github-lifecycle/spec-issue-manifest.test.js",
        "npm run agent:check"
      ],
      "non_goals": [
        "No GitHub writes.",
        "No issue assignment or mission launch.",
        "No generic project-management database."
      ]
    },
    {
      "issue_id": "GHL-004",
      "title": "Add conflict-safe issue and claim adapters",
      "summary": "GitHub claim reducer plus guarded issue, claim/renew/release/recovery, assignment, and receipt verbs as `kehle-contributor-agent`.",
      "owner_repository": "kehle-tdg-dev/ucla-tdg-ip-agents",
      "write_class": "propose",
      "requirements": ["GHL-REQ-01", "GHL-REQ-02", "GHL-NFR-01", "GHL-NFR-02"],
      "depends_on": ["GHL-003"],
      "external_dependencies": ["Verified `ACT-REV-02`"],
      "acceptance_criteria": [
        "Implement the `github-lifecycle-claim.v1` reducer using GitHub comment server order, predecessor validation, legal transitions, and first-successor wins.",
        "Provide dry-run and explicitly write-enabled issue-batch verbs.",
        "Verify repository allowlist, authenticated actor, manifest hash, and existing issue markers before writing.",
        "Upsert without duplicating issues on replay.",
        "Implement claim, renew, bind-mission, packet-ready, published, release, and recovery events with stable idempotency keys.",
        "Authenticate issue, claim/release/recovery, assignment, and marker writes as `kehle-contributor-agent`.",
        "Confirm reducer ownership and assignment before permitting mission start.",
        "Enforce policy-bounded lease, renewal, expired-pending-recovery, and terminal-state recovery behavior.",
        "Detect and record conflicting claims without starting a mission.",
        "Record exact GitHub object URLs and write receipts.",
        "Never authenticate as Joel."
      ],